{"$schema":"https://json-schema.org/draft/2020-12/schema","$id":"https://catalog.local/schemas/v1/package-entry.schema.json","title":"package-entry","type":"object","additionalProperties":false,"required":["path","role","source_reference","source_sha256","source_size","destination_sha256","destination_size","product_identity","mime","policy_rule","evidence_references"],"properties":{"path":{"type":"string","pattern":"^(?!/)(?!.*\\\\)(?!.*(?:^|/)\\.\\.(?:/|$)).+$"},"role":{"enum":["catalog_master","importable_products","category_mapping","provenance","producto","primary","secondary","technical_sheet","document","schema"]},"source_reference":{"type":"string"},"source_sha256":{"$ref":"common-definitions.schema.json#/$defs/sha256"},"source_size":{"type":"integer","minimum":0},"destination_sha256":{"$ref":"common-definitions.schema.json#/$defs/sha256"},"destination_size":{"type":"integer","minimum":0},"product_identity":{"type":["string","null"]},"mime":{"type":["string","null"]},"policy_rule":{"type":"string"},"evidence_references":{"type":"array","items":{"type":"string"}}}}
