{"path":"catalog/importable-products.jsonl","role":"importable_products","source_reference":"package-eligible-products.jsonl","source_sha256":"aaaaaaaaaaaaaaaaaaaaaaaaaaaaaaaaaaaaaaaaaaaaaaaaaaaaaaaaaaaaaaaa","source_size":1,"destination_sha256":"aaaaaaaaaaaaaaaaaaaaaaaaaaaaaaaaaaaaaaaaaaaaaaaaaaaaaaaaaaaaaaaa","destination_size":1,"product_identity":null,"mime":null,"policy_rule":"catalog-audit-v1","evidence_references":[]}
